### ISSUE TITLE
emq server does not send messages to the outside

### ISSUE THREAD

**Issue by ArmorHerO** [emqtt/emqttd#1177]
#### Environment

- OS: CentOS Linux release 7.3.1611 (Core) 
- Erlang/OTP: version 8.1
- EMQ: emqttd2.2

#### Description
We have a problem, emq client did not receive emqtt server sent the news, our process is   API -> emq_server -> emq_client, after capturing Packet found that the APIserver to emq server package served , But the emqserver package did not send out, the following is our capturing packet results

API-->emq_server
                                        source     dest
14	12:46:34.175100	API	emq_server	Ping Request	68	MQTT	
15	12:46:34.175125	emq_server	API	1883 → 53656 [ACK] Seq=1 Ack=3 Win=1452 Len=0 TSval=347952538 TSecr=2019330668	66	TCP	
16	12:46:34.175277	emq_server  	API	Ping Response	68	MQTT	
17	12:46:34.187971	API	emq_server	53656 → 1883 [ACK] Seq=3 Ack=3 Win=229 Len=0 TSval=2019330681 TSecr=347952539	66	TCP	
19	12:46:34.228610	API	emq_server	Publish Message	372	MQTT	
20	12:46:34.269137	emq_server	API	1883 → 53656 [ACK] Seq=3 Ack=309 Win=1452 Len=0 TSval=347952633 TSecr=2019330721	66	TCP	

emq_server-->emq_clitent

25	12:46:35.984007	emq_clitent	emq_server	Ping Request	68	MQTT	
26	12:46:35.984236	emq_server	emq_clitent	Ping Response	68	MQTT
27	12:46:35.994943	emq_clitent	emq_server	49069 → 1883 [ACK] Seq=3 Ack=3 Win=1369 Len=0 TSval=5054508 TSecr=3933449470	66	TCP	

This show is not always present , but only occasionally, what is the reason for this? emq_server is the problem, or the problem of our APIserver?

**Comment by turtleDeng** [comment]
@ArmorHerO  Please use ./bin/emqttd console, open debug level log

**Comment by ArmorHerO** [comment]
@turtleDeng 
The following is the logs,we will pass some pictures, the log information is relatively large, so I did not stick out
For security reasons, I put the corresponding emq client IP to emq_clitent, APIserver IP replaced by api_server

2017-08-01 15:05:47.910 [debug] <0.1328.0>@emqttd_client:handle_info:235 Client(118.198.7.27:36364): RECV <<192,0>>
2017-08-01 15:05:47.910 [info] <0.1328.0>@emqttd_protocol:trace:347 Client(18501344613@118.198.7.27:36364): RECV PINGREQ(Q0, R0, D0)
2017-08-01 15:05:47.911 [info] <0.1328.0>@emqttd_protocol:trace:350 Client(18501344613@118.198.7.27:36364): SEND PINGRESP(Q0, R0, D0)
2017-08-01 15:05:47.911 [debug] <0.1328.0>@emqttd_client:send_fun:137 Client(emq_clitent:36364): SEND [<<"Ð">>,<<0>>,<<>>,<<>>]
2017-08-01 15:05:49.428 [debug] <0.1320.0>@emqttd_client:handle_info:235 Client(api_server:51616): RECV <<56,175,2,0,49,97,110,108,111,113,47,49,56,54,48,48,56,55,57,56,54,51,101,49,48,97,100,99,51,57,52,57,98,97,53,57,97,98,98,101,53,54,101,48,53,55,102,50,48,102,56,56,51,101,101,121,74,117,89,87,49,108,73,106,111,105,90,88,70,48,89,50,70,115,98,67,73,115,73,109,57,105,97,109,86,106,100,67,73,54,101,121,74,108,99,88,82,102,98,109,70,116,90,83,73,54,73,117,83,52,114,101,87,70,115,43,97,100,107,101,87,119,106,43,87,77,117,115,75,51,77,84,65,119,53,89,43,51,53,113,87,56,77,101,87,78,108,101,87,70,103,121,73,115,73,109,86,120,100,70,57,112,90,67,73,54,73,106,69,119,77,68,65,119,77,67,73,115,73,110,86,117,97,88,82,102,97,87,81,105,79,105,73,120,77,68,65,119,77,68,65,105,76,67,74,105,89,87,57,112,90,67,73,54,73,106,86,106,79,109,89,52,79,106,73,120,79,109,82,108,79,106,85,49,79,106,100,106,73,105,119,105,89,50,57,116,98,87,70,117,90,67,73,54,77,72,48,115,73,110,82,112,98,87,85,105,79,105,73,121,77,68,69,51,76,84,65,52,76,84,65,120,86,68,69,49,79,106,65,49,79,106,81,53,76,106,81,120,79,70,111,105,102,81,61,61>>
2017-08-01 15:05:49.429 [info] <0.1320.0>@emqttd_protocol:trace:347 Client(mqttjs_bf69cab4@api_server:51616): RECV PUBLISH(Q0, R0, D1, Topic=anloq/18600879863e10adc3949ba59abbe56e057f20f883e, PacketId=undefined, Payload=<<"eyJuYW1lIjoiZXF0Y2FsbCIsIm9iamVjdCI6eyJlcXRfbmFtZSI6IuS4reWFs+adkeWwj+WMusK3MTAw5Y+35qW8MeWNleWFgyIsImVxdF9pZCI6IjEwMDAwMCIsInVuaXRfaWQiOiIxMDAwMDAiLCJiYW9pZCI6IjVjOmY4OjIxOmRlOjU1OjdjIiwiY29tbWFuZCI6MH0sInRpbWUiOiIyMDE3LTA4LTAxVDE1OjA1OjQ5LjQxOFoifQ==">>)
2017-08-01 15:05:49.429 [info] <0.1320.0>@emqttd_server:trace:105 mqttjs_bf69cab4/anloqmqtt0 PUBLISH to anloq/18600879863e10adc3949ba59abbe56e057f20f883e: <<"eyJuYW1lIjoiZXF0Y2FsbCIsIm9iamVjdCI6eyJlcXRfbmFtZSI6IuS4reWFs+adkeWwj+WMusK3MTAw5Y+35qW8MeWNleWFgyIsImVxdF9pZCI6IjEwMDAwMCIsInVuaXRfaWQiOiIxMDAwMDAiLCJiYW9pZCI6IjVjOmY4OjIxOmRlOjU1OjdjIiwiY29tbWFuZCI6MH0sInRpbWUiOiIyMDE3LTA4LTAxVDE1OjA1OjQ5LjQxOFoifQ==">>
2017-08-01 15:05:49.946 [debug] <0.1332.0>@emqttd_client:handle_info:235 Client(118.198.7.27:53882): RECV <<192,0>>
2017-08-01 15:05:49.946 [info] <0.1332.0>@emqttd_protocol:trace:347 Client(18600879863@emq_clitent:53882): RECV PINGREQ(Q0, R0, D0)
2017-08-01 15:05:49.946 [info] <0.1332.0>@emqttd_protocol:trace:350 Client(18600879863@emq_clitet:53882): SEND PINGRESP(Q0, R0, D0)
2017-08-01 15:05:49.946 [debug] <0.1332.0>@emqttd_client:send_fun:137 Client(emq_clitent:53882): SEND [<<"Ð">>,<<0>>,<<>>,<<>>]
2017-08-01 15:05:51.532 [debug] <0.1320.0>@emqttd_client:handle_info:235 Client(api_server:51616): RECV <<48,147,70,0,53,97,110,108,111,113,47,105,109,103,47,49,56,54,48,48,56,55,57,56,54,51,101,49,48,97,100,99,51,57,52,57,98,97,53,57,97,98,98,101,53,54,101,48,53,55,102,50,48,102,56,56,51,101,85,107,108,71,82,115,81,90,65,65,66,88,82,85,74,81,86,108,65,52,73,76,103,90,65,65,66,119,55,81,67,100,65,83,113,65,65,117,65,66,80,114,86,89,112,107,56,110,74,75,103,116,73,98,72,74,121,97,65,87,105,87,100,117,50,81,99,56,110,70,108,105,72,115,111,97,10,108,53,69,101,50,119,72,50,52,97,72,48,84,57,54,47,82,51,55,74,53,104,47,75,103,70,66,49,111,43,79,87,105,97,117,109,47,115,101,103,86,122,56,47,111,102,82,88,43,71,102,57,53,51,52,111,114,74,101,88,71,90,78,49,110,81,80,67,121,113,115,65,43,51,102,77,10,117,54,112,89,80,75,43,88,80,120,68,111,56,82,47,110,57,116,43,108,80,72,105,100,84,102,54,112,67,113,114,53,47,111,81,74,72,86,56,49,80,120,72,70,112,97,98,71,84,74,112,54,112,104,47,86,54,50,103,110,72,116,80,48,73,120,102,88,53,84,118,76,86,80,74,69,10,97,69,113,87,76,65,55,105,67,68,122,108,86,74,122,67,108,115,100,97,89,53,86,79,99,110,73,76,111,119,47,116,51,86,115,114,121,100,103,98,80,67,66,43,76,50,51,103,65,108,97,81,43,114,100,102,68,79,102,121,76,72,81,72,108,86,72,89,43,79,43,122,80,104,54,112,10,47,77,68,47,43,120,79,118,77,70,119,118,113,111,89,55,67,65,102,118,55,49,88,117,53,121,107,48,82,55,68,49,89,86,82,121,77,77,75,53,81,53,120,83,80,117,120,108,86,52,57,103,107,119,102,119,86,55,71,57,89,120,53,69,110,101,70,43,55,85,106,74,82,49,104,66,10,109,85,65,79,81,79,85,50,72,87,79,73,71,43,70,87,98,84,105,43,55,69,119,90,114,78,78,72,68,66,106,110,120,56,79,70,108,107,52,88,43,107,72,102,49,72,90,75,48,100,114,105,68,76,103,89,68,75,48,69,65,117,67,47,78,65,104,78,100,101,85,70,90,84,98,82,10,106,47,67,103,66,67,77,72,57,109,53,103,99,86,100,78,97,84,80,109,83,52,84,102,109,89,51,80,90,49,115,89,100,53,101,48,76,114,101,120,47,99,83,52,88,87,109,55,51,118,70,104,85,52,82,54,76,89,78,116,85,111,98,48,105,55,65,87,81,122,78,66,53,78,101,55,10,53,112,112,103,112,111,102,73,69,121,101,80,70,84,49,80,77,86,89,67,110,90,84,88,53,99,118,87,109,68,84,75,66,116,76,87,53,78,49,117,98,50,79,73,117,85,114,55,70,68,109,117,90,65,57,76,107,47,117,55,49,100,43,70,87,55,101,106,70,97,71,109,72,79,80,52,10,71,112,102,120,115,69,43,117,118,119,71,116,48,88,82,85,76,119,112,118,112,52,108,80,104,116,100,105,65,69,47,108,85,73,121,85,102,110,70,86,67,113,88,116,117,99,112,74,117,98,120,80,67,101,117,56,84,97,48,56,97,71,76,75,84,111,99,107,97,103,82,51,77,52,114,83,10,72,57,75,118,116,88,56,89,111,108,55,84,121,51,54,75,90,86,111,114,82,78,111,111,100,54,112,102,83,65,119,66,76,72,75,122,69,65,81,68,66,117,74,85,100,68,113,100,110,47,54,69,110,107,81,113,118,72,73,107,120,83,90,101,118,99,43,101,83,109,89,107,74,111,70,109,10,114,76,52,98,110,78,119,106,68,72,52,86,66,77,112,79,48,117,74,114,106,74,66,76,116,50,49,76,107,83,82,98,65,110,76,75,54,69,103,80,76,67,67,68,87,43,81,104,69,74,119,50,52,113,109,80,69,72,87,66,118,78,71,105,80,75,43,113,57,116,75,57,84,70,48,121,10,57,109,70,47,49,51,122,57,79,67,85,50,57,66,87,73,113,100,77,81,122,104,86,98,90,115,89,65,108,119,71,84,113,113,102,81,55,107,50,54,108,100,121,74,87,103,109,99,78,83,76,117,68,81,52,118,76,65,70,106,56,55,48,50,70,112,116,50,120,89,111,102,80,74,86,87,10,104,48,104,73,86,65,110,103,77,66,72,66,102,109,100,88,121,79,118,119,71,55,52,57,107,107,99,69,54,98,106,76,97,65,73,84,80,56,68,85,119,109,84,84,72,74,107,81,51,103,115,57,119,84,55,71,122,116,119,88,71,82,53,55,106,68,84,85,47,47,50,50,80,50,104,109,10,82,103,72,68,117,74,116,98,77,104,89,118,48,56,113,79,109,114,116,57,57,53,89,119,50,102,121,50,108,118,98,90,85,53,80,120,47,103,47,114,72,55,80,121,108,122,67,73,72,121,113,85,117,119,104,56,65,75,121,79,79,66,109,105,47,56,74,122,85,67,116,90,66,72,73,52,10,87,106,43,84,107,47,73,107,97,85,52,54,97,120,53,117,69,80,57,73,111,108,89,84,82,67,110,66,103,57,120,107,48,75,78,84,107,69,112,116,65,108,111,103,111,98,110,86,111,113,87,66,69,120,111,88,71,112,48,87,108,75,75,89,102,104,71,70,56,110,97,114,75,90,79,104,10,...>>

**Comment by ArmorHerO** [comment]
@emqplus I may find the problem, it may be the client's problem, we now found that the topics of the subscription will be lost, and in non-abnormal state, sometimes the tunnel will be disconnected and no longer re-connected。
